{
  "schema_version": "0.1",
  "project": {
    "paper_pdf": "paper.pdf",
    "template_pptx": "../skills/paper-ppt-orchestrator/assets/seminar-template.pptx",
    "output_pptx": "../runs/example/build/presentation.pptx",
    "one_page_image": "../runs/example/assets/one-page/one-page.png",
    "author_visual": "../runs/example/assets/paper/author-affiliations.png",
    "presenter": "程逸飞",
    "advisor": "朱宇佳",
    "language": "zh-CN",
    "target_minutes": 15,
    "target_slide_count": 14,
    "final_readability_mode": "off",
    "supported_layouts": ["content_stacked"]
  },
  "paper": {
    "title_en": "Clearing the Clutter: Real-Time Program-Specific Log Consolidation for APT Detection",
    "title_cn": "清除杂乱：面向 APT 检测的实时程序特定日志合并",
    "authors": ["Xiao Han", "Jiahao Xue", "Zhuo Lu", "Yao Liu"],
    "venue": "IEEE INFOCOM",
    "year": 2026,
    "contributions": [
      {
        "runs": [
          {"text": "提出 ", "emphasis": "none"},
          {"text": "Nano 实时日志缩减框架", "emphasis": "bold"},
          {"text": "，在日志生成阶段直接合并冗余依赖，避免传统语义剪枝等待完整溯源图后再进行离线分析的处理延迟。", "emphasis": "none"}
        ]
      },
      {
        "runs": [
          {"text": "设计 ", "emphasis": "none"},
          {"text": "profile hierarchy", "emphasis": "bold"},
          {"text": " 与 ", "emphasis": "none"},
          {"text": "access network", "emphasis": "bold"},
          {"text": " 两层结构，分别保存程序执行来源和对象访问关系，在合并重复 subject 时保留攻击调查所需上下文。", "emphasis": "none"}
        ]
      },
      {
        "runs": [
          {"text": "在 ", "emphasis": "none"},
          {"text": "DARPA E3/E5 六个数据集", "emphasis": "bold"},
          {"text": "上验证方法，访问网络缩减率覆盖 ", "emphasis": "none"},
          {"text": "27.3-219 倍", "emphasis": "bold"},
          {"text": "，并保持与现有规则型入侵检测系统可比的攻击检测能力。", "emphasis": "none"}
        ]
      }
    ],
    "doi_or_url": "10.1109/INFOCOM59046.2026.11571209"
  },
  "sections": [
    {"id": "background", "title": "基本概念与问题背景"},
    {"id": "method", "title": "方法设计"},
    {"id": "results", "title": "实验结果"},
    {"id": "reflection", "title": "总结思考"}
  ],
  "evidence": [
    {
      "id": "E001",
      "claim": "APT 调查需要跨事件的上下文连接，溯源图用于保留系统实体之间的数据依赖。",
      "kind": "paper_claim",
      "paper_page": 1,
      "paper_section": "Introduction",
      "quote_or_summary": "论文用溯源图组织 subject、file 和 network socket 之间的依赖，以支持攻击调查。",
      "confidence": "high"
    },
    {
      "id": "E002",
      "claim": "系统日志会快速增长并造成显著的服务器内存和长期保留成本。",
      "kind": "paper_claim",
      "paper_page": 1,
      "paper_section": "Introduction",
      "quote_or_summary": "论文报告每台主机每天约 1GB 到 33GB 的日志生成量。",
      "confidence": "high"
    },
    {
      "id": "E003",
      "claim": "Nano 通过 profile hierarchy 表示程序执行来源。",
      "kind": "paper_claim",
      "paper_page": 1,
      "paper_section": "Abstract",
      "quote_or_summary": "Profile hierarchy 用程序间执行关系抽象 subject origin。",
      "confidence": "high"
    },
    {
      "id": "E004",
      "claim": "Nano 通过 access network 合并相同执行顺序下 subject 的活动依赖。",
      "kind": "paper_claim",
      "paper_page": 1,
      "paper_section": "Abstract",
      "quote_or_summary": "Access network 将重复活动汇总为 executing program 与 system entity 的依赖。",
      "confidence": "high"
    },
    {
      "id": "E005",
      "claim": "论文评估显示 Nano 在运行时最高可将日志缩减 219 倍，同时保持与现有规则检测相当的攻击检测能力。",
      "kind": "paper_claim",
      "paper_page": 1,
      "paper_section": "Abstract",
      "artifact_label": "Evaluation summary",
      "quote_or_summary": "摘要给出最高 219x reduction，并说明攻击检测效果可与现有 rule-based IDS 相比。",
      "confidence": "high"
    },
    {
      "id": "E006",
      "claim": "把进程实例提升为执行上下文表示，是可迁移到其他高重复事件流的设计启发。",
      "kind": "presenter_analysis",
      "quote_or_summary": "汇报者从 profile hierarchy 和 access network 提炼的迁移性判断。",
      "confidence": "medium"
    },
    {
      "id": "E007",
      "claim": "最高缩减倍数不能单独代表所有工作负载下的稳定收益。",
      "kind": "presenter_analysis",
      "quote_or_summary": "汇报时应同时讨论数据集、负载差异和最坏情况，而不是只展示峰值。",
      "confidence": "medium"
    }
  ],
  "slides": [
    {"id": "S01", "type": "cover", "title": "清除杂乱：面向 APT 检测的实时程序特定日志合并"},
    {"id": "S02", "type": "paper_info", "title": "论文信息与核心贡献"},
    {"id": "S03", "type": "one_page", "title": "一页纸总结"},
    {"id": "S04", "type": "contents", "title": "目录"},
    {"id": "S05", "type": "section_divider", "section_id": "background", "title": "基本概念与问题背景"},
    {
      "id": "S06",
      "type": "content",
      "section_id": "background",
      "title": "溯源图保留调查上下文，也放大了日志规模",
      "purpose": "说明论文要同时解决的调查价值与存储压力。",
      "takeaway": "问题不是简单删日志，而是在保留攻击依赖的同时压缩重复行为。",
      "layout": "content_stacked",
      "body": [
        {
          "runs": [
            {"text": "溯源图", "emphasis": "bold"},
            {"text": "把进程、文件、网络对象及其因果依赖连接起来，使分析人员能够沿攻击路径回溯跨主机、跨阶段的行为上下文，而不是只检查孤立告警。", "emphasis": "none"}
          ],
          "evidence_ids": ["E001"]
        },
        {
          "runs": [
            {"text": "日志规模", "emphasis": "bold"},
            {"text": "可达到每台主机每天 1GB-33GB；当企业拥有数百台主机并需要长期留存时，存储、传输和后续图分析开销会同步放大。", "emphasis": "none"}
          ],
          "evidence_ids": ["E002"]
        },
        {
          "runs": [
            {"text": "核心矛盾", "emphasis": "bold"},
            {"text": "不是简单删除事件，而是在压缩大量重复行为的同时继续保留检测规则和攻击调查真正依赖的关系，避免缩减率以信息损失为代价。", "emphasis": "none"}
          ],
          "evidence_ids": ["E001", "E002"]
        }
      ],
      "visual": {
        "mode": "imagegen",
        "rationale": "本页只建立日志洪流与攻击上下文的概念冲突，不承载精确系统结构。",
        "asset_ref": "../runs/example/assets/imagegen/apt-provenance-concept.png",
        "source_refs": [],
        "caption": "概念示意图，不代表论文系统架构",
        "alt_text": "服务器日志流汇聚为溯源关系图的概念示意图",
        "expected_aspect_ratio": "wide",
        "prompt": "16:9 academic presentation illustration of enterprise servers producing a large audit log stream that resolves into a provenance graph, blue and gray with one restrained orange attack path, no text, no labels, no logo, no watermark",
        "no_text": true,
        "qa_status": "ready"
      },
      "speaker_notes": "先解释溯源图为什么有价值，再引出日志增长。这里不把概念图当作论文证据，具体数字回到论文第一页。",
      "review": {"content_approved": false, "visual_approved": false}
    },
    {
      "id": "S07",
      "type": "content",
      "section_id": "background",
      "title": "重复执行序列是日志膨胀的直接来源",
      "purpose": "用论文示例说明重复 subject 如何产生结构相似的事件。",
      "takeaway": "按执行上下文合并，比按单个进程实例保留更适合高重复工作负载。",
      "layout": "content_stacked",
      "body": [
        {
          "runs": [
            {"text": "Linux/Unix", "emphasis": "bold"},
            {"text": " 环境频繁使用 fork/exec 创建短生命周期进程；同一个工具会被脚本、守护进程和服务反复调用，从而产生大量结构近似但实例不同的 subject。", "emphasis": "none"}
          ],
          "evidence_ids": ["E002"]
        },
        {
          "runs": [
            {"text": "论文 Fig.1", "emphasis": "bold"},
            {"text": "展示多个 vmstat subject 具有相同的程序执行顺序和相似 ancestry，但传统溯源图仍为每个实例分别保存进程节点、事件和依赖边。", "emphasis": "none"}
          ],
          "evidence_ids": ["E002"]
        },
        {
          "runs": [
            {"text": "可合并条件", "emphasis": "bold"},
            {"text": "应由执行上下文是否等价决定，而不是仅比较进程名称或日志文本；这样既能消除重复实例，又不会把来源不同、语义不同的活动错误合并。", "emphasis": "none"}
          ],
          "evidence_ids": ["E002"]
        }
      ],
      "visual": {
        "mode": "paper_asset",
        "rationale": "保留论文中的真实执行序列示例。",
        "asset_ref": "../runs/example/assets/paper/fig1-execution-sequence.png",
        "source_refs": ["Fig.1"],
        "caption": "论文 Fig.1",
        "alt_text": "多个 vmstat subject 具有相似祖先关系的论文示例图",
        "expected_aspect_ratio": "wide",
        "qa_status": "ready"
      },
      "speaker_notes": "这一页用于说明重复来自执行实例，而不是简单的完全相同文本，并为下一页的上下文抽象建立动机。",
      "review": {"content_approved": false, "visual_approved": false}
    },
    {"id": "S08", "type": "section_divider", "section_id": "method", "title": "方法设计"},
    {
      "id": "S09",
      "type": "content",
      "section_id": "method",
      "title": "Nano 将实例级事件合并为程序上下文依赖",
      "purpose": "解释 Nano 的两个核心数据结构及其分工。",
      "takeaway": "Profile hierarchy 记录来源，access network 记录访问对象。",
      "layout": "content_stacked",
      "body": [
        {
          "runs": [
            {"text": "Profile hierarchy", "emphasis": "bold"},
            {"text": "把 subject 的实例级 ancestry 提升为程序执行关系，记录一个程序由哪些父程序和执行路径产生，从而为后续合并提供稳定的来源上下文。", "emphasis": "none"}
          ],
          "evidence_ids": ["E003"]
        },
        {
          "runs": [
            {"text": "Access network", "emphasis": "bold"},
            {"text": "在来源上下文一致时，把重复 subject 对文件、进程和网络对象的活动汇总为程序级 access link，减少实例节点和重复依赖边。", "emphasis": "none"}
          ],
          "evidence_ids": ["E004"]
        },
        {
          "runs": [
            {"text": "信息保留", "emphasis": "bold"},
            {"text": "并非把所有访问压成计数，而是继续维护 access link 之间与攻击活动相关的依赖，使规则型检测能够在压缩后的结构上恢复关键攻击链。", "emphasis": "none"}
          ],
          "evidence_ids": ["E003", "E004"]
        }
      ],
      "visual": {
        "mode": "tikz",
        "rationale": "需要用一张综合结构图说明两个数据结构的分工，而不是复制密集论文图。",
        "asset_ref": "../runs/example/assets/tikz/profile-merge-demo.png",
        "source_refs": ["E003", "E004"],
        "caption": "根据论文方法整理的汇报者示意图",
        "alt_text": "重复进程实例被映射到 profile hierarchy，并通过 access network 连接访问对象",
        "expected_aspect_ratio": "wide",
        "qa_status": "ready"
      },
      "speaker_notes": "强调两种结构解决不同信息：来源链和对象访问。图是汇报者综合示意，不是论文原图。",
      "review": {"content_approved": false, "visual_approved": false}
    },
    {"id": "S10", "type": "section_divider", "section_id": "results", "title": "实验结果"},
    {
      "id": "S11",
      "type": "content",
      "section_id": "results",
      "title": "运行时最高缩减 219 倍，同时保留攻击检测能力",
      "purpose": "用论文证据概括效率和检测效果。",
      "takeaway": "Nano 的价值来自高缩减率与攻击依赖保留的共同成立。",
      "layout": "content_stacked",
      "body": [
        {
          "runs": [
            {"text": "跨数据集差异", "emphasis": "bold"},